{
  "$schema": "../schema.json",
  "assessment_id": "DSGAI-RA-customer-rag-banking",
  "scenario_name": "Customer-facing RAG chatbot over retail-banking knowledge base",
  "entry_type": "synthetic_template",
  "industry_sector": "financial_services",
  "deployment_pattern": "customer_facing_chatbot",
  "description": "A retail bank deploys a customer-facing chatbot that answers product, fee, and account-handling questions by retrieving from a curated knowledge corpus. Authenticated sessions may query a read-only tool that returns the customer's own account balance and recent transactions. Hosted third-party LLM under an enterprise data-isolation contract; in-region managed vector store; in-house RAG ingestion; input + output guardrails. Mature financial-services baseline.",
  "assumptions": [
    "All KB content is bank-owned; no third-party ingestion at runtime.",
    "Account-balance tool is read-only and scoped to the authenticated customer.",
    "LLM provider contract excludes training on customer data."
  ],
  "components": [
    {"role": "llm_provider", "description": "Hosted third-party general-purpose LLM, enterprise tier with customer-data isolation.", "sensitivity_tier": "high"},
    {"role": "embedding_model", "description": "Provider-hosted embedding model for KB chunking and query encoding.", "sensitivity_tier": "medium"},
    {"role": "vector_store", "description": "Managed in-region vector store with per-collection ACLs.", "sensitivity_tier": "high"},
    {"role": "rag_pipeline", "description": "Internal batch ingestion: CMS pull, chunk, embed, index.", "sensitivity_tier": "high"},
    {"role": "tool_or_plugin", "description": "Read-only balance lookup tool, per-session token, customer-scoped.", "sensitivity_tier": "critical"},
    {"role": "guardrail_or_filter", "description": "Input and output classifiers (PII, jailbreak, toxic content).", "sensitivity_tier": "high"},
    {"role": "identity_provider", "description": "Bank IDP issuing short-lived tokens bound to the authenticated customer.", "sensitivity_tier": "critical"},
    {"role": "observability_stack", "description": "Centralized logging with field-level redaction; 30-day retention.", "sensitivity_tier": "high"},
    {"role": "client_application", "description": "Authenticated web/mobile chat front-ends.", "sensitivity_tier": "medium"}
  ],
  "risks_identified": [
    {"dsgai_id": "DSGAI01", "inherent_rating": "Critical", "rationale": "RAG retrieves policy documents and balance tool returns sensitive financial data into the model context.", "residual_rating": "Medium", "residual_rationale": "Per-customer scope; output PII redaction; redacted logging."},
    {"dsgai_id": "DSGAI02", "inherent_rating": "High", "rationale": "Tool credentials must be scoped per-session; misconfiguration enables cross-customer access.", "residual_rating": "Low", "residual_rationale": "Short-lived per-session IDP tokens; tool calls audited."},
    {"dsgai_id": "DSGAI06", "inherent_rating": "High", "rationale": "Indirect prompt injection via KB content could coerce balance-tool misuse.", "residual_rating": "Medium", "residual_rationale": "Editorial review on ingestion; injection detection at retrieval."},
    {"dsgai_id": "DSGAI08", "inherent_rating": "High", "rationale": "GDPR, CCPA, GLBA, and (for EU footprint) DORA + EU AI Act obligations apply.", "residual_rating": "Medium", "residual_rationale": "DPIA on file; processor terms in place; DSR pipeline integrated."},
    {"dsgai_id": "DSGAI11", "inherent_rating": "High", "rationale": "Shared vector store and shared session cache create cross-customer leak risk if isolation breaks.", "residual_rating": "Low", "residual_rationale": "Per-customer retrieval filter; no cross-session memory store."},
    {"dsgai_id": "DSGAI13", "inherent_rating": "Medium", "rationale": "Vector store holds chunked KB content; embedding inversion is a documented attack class.", "residual_rating": "Low", "residual_rationale": "Same KMS as primary KB; per-collection ACLs."},
    {"dsgai_id": "DSGAI14", "inherent_rating": "Medium", "rationale": "Logged prompts/responses can contain financial data and PII.", "residual_rating": "Low", "residual_rationale": "Field-level redaction at log ingestion."},
    {"dsgai_id": "DSGAI17", "inherent_rating": "Medium", "rationale": "Regulated customer channel; LLM-provider outage propagates to channel impact.", "residual_rating": "Medium", "residual_rationale": "Static fallback flow; multi-provider failover not yet."},
    {"dsgai_id": "DSGAI21", "inherent_rating": "Medium", "rationale": "Adversarial submissions via public surfaces could pollute KB if processes weaken.", "residual_rating": "Low", "residual_rationale": "Strict CMS-authored ingestion; no runtime external feeds."}
  ],
  "existing_controls": [
    {"description": "Per-customer retrieval scope on every query.", "tier": "Tier 1", "addresses_dsgai": ["DSGAI11", "DSGAI01"]},
    {"description": "Short-lived per-session IDP tokens for tool calls.", "tier": "Tier 1", "addresses_dsgai": ["DSGAI02", "DSGAI06"]},
    {"description": "Input/output PII regex classifiers tuned for banking domain (account numbers, SSN, card PAN).", "tier": "Tier 1", "addresses_dsgai": ["DSGAI01", "DSGAI14"]},
    {"description": "Editorial gate on KB ingestion; injection-detection at retrieval time.", "tier": "Tier 2", "addresses_dsgai": ["DSGAI06", "DSGAI21"]},
    {"description": "Field-level log redaction; 30-day retention.", "tier": "Tier 1", "addresses_dsgai": ["DSGAI14"]},
    {"description": "DPIA + DSR pipeline integrated with bank DSAR process.", "tier": "Tier 3", "addresses_dsgai": ["DSGAI08", "DSGAI07"]},
    {"description": "Sanitized markdown rendering; external image hosts blocklisted in assistant egress.", "tier": "Tier 1", "addresses_dsgai": ["DSGAI01", "DSGAI15"]},
    {"description": "Static fallback flow for LLM-provider degradation.", "tier": "Tier 2", "addresses_dsgai": ["DSGAI17"]}
  ],
  "control_gaps": [
    {"description": "No multi-provider LLM failover.", "addresses_dsgai": ["DSGAI17"], "suggested_remediation": "Add second LLM provider as warm standby; exercise failover periodically.", "urgency": "Near-term"},
    {"description": "Context truncation not topic-aware.", "addresses_dsgai": ["DSGAI15"], "suggested_remediation": "Task-classifier-driven retrieval scoping.", "urgency": "Near-term"},
    {"description": "Embedding inversion risk not explicitly tested.", "addresses_dsgai": ["DSGAI18", "DSGAI13"], "suggested_remediation": "Annual Vec2Text-style inversion test; rotate embedding model if threshold exceeded.", "urgency": "Strategic"},
    {"description": "Adversarial red-team not yet a release gate.", "addresses_dsgai": ["DSGAI21", "DSGAI06"], "suggested_remediation": "Add published red-team corpus to release gate; track refusal stability.", "urgency": "Near-term"}
  ],
  "framework_alignments": [
    {"framework": "NIST CSF 2.0", "control_id": "PR.DS-01", "control_name": "Data-at-rest is protected", "alignment_status": "satisfied"},
    {"framework": "NIST CSF 2.0", "control_id": "PR.AC-01", "control_name": "Identities and credentials are managed", "alignment_status": "satisfied"},
    {"framework": "NIST CSF 2.0", "control_id": "DE.CM-01", "control_name": "The network is monitored", "alignment_status": "partial"},
    {"framework": "NIST AI RMF 1.0", "control_id": "MEASURE 2.7", "control_name": "AI system security is evaluated", "alignment_status": "partial"},
    {"framework": "NIST AI RMF 1.0", "control_id": "GOVERN 5.1", "control_name": "Policies and procedures for AI risk", "alignment_status": "satisfied"},
    {"framework": "ISO/IEC 42001", "control_id": "A.6.2.6", "control_name": "AI system impact assessment", "alignment_status": "satisfied"},
    {"framework": "ISO/IEC 42001", "control_id": "A.8.2", "control_name": "Data resources for AI systems", "alignment_status": "satisfied"},
    {"framework": "ISO/IEC 27001", "control_id": "A.5.34", "control_name": "Privacy and protection of PII", "alignment_status": "satisfied"},
    {"framework": "OWASP LLM Top 10 2025", "control_id": "LLM01:2025", "control_name": "Prompt Injection", "alignment_status": "partial"},
    {"framework": "OWASP LLM Top 10 2025", "control_id": "LLM02:2025", "control_name": "Sensitive Information Disclosure", "alignment_status": "satisfied"},
    {"framework": "GDPR", "control_id": "Art. 35", "control_name": "Data protection impact assessment", "alignment_status": "satisfied"},
    {"framework": "EU AI Act", "control_id": "Art. 26", "control_name": "Obligations of deployers of high-risk AI systems", "alignment_status": "partial"},
    {"framework": "SOC 2", "control_id": "CC6.1", "control_name": "Logical and physical access controls", "alignment_status": "satisfied"}
  ],
  "compliance_obligations": ["GDPR", "CCPA", "SOC 2", "ISO 27001 certification", "EU AI Act", "DORA"],
  "maturity_overall": "Managed",
  "date_added": "2026-05-18",
  "tags": ["rag", "customer-facing", "financial-services", "tool-use", "regulated"]
}
